question,answers,num_answers
"Haha thank you, I guess I'm just a natural. What's your favourite game?","[""I really like to play tennis, badminton and racquetball. I don't really get a chance to play them often though, specially racquetball""]",1
"What's racquetball like? From context clues, I'm guessing that it involves hitting a ball with a racquet","[""well, it's like a cage match of tennis. The main difference is that both players play in the same 'court' and the ball is smashed against a wall instead of passing it over a net into the opponent's court. Kind of like playing pingpong vs the table.""]",1
Wow! A cage match! Does it get physical?,"['it depends haha, there is a lot of bumping into each other to run after the ball, and sometimes the ball hits you too. Overall it feels like a super fast paced version of tennis, really tiring!', ""That sounds fun. I think of tennis itself as being really athletic and tiring, so I don't think it's a sport for me, though!""]",2
ping pong can get quite intensive too! I guess short ping pong sessions are not that tiring though. Wanna have a match?,"[""What a good idea, I'd love to!"", 'Show me your anger!!!!', 'Fuckkkkkkk!!!!', 'Hi!', 'hi']",5
me? just chilling out at work. what is code refactoring?,"[""good question. I don't even know what I am doing""]",1
"haha, forget it. what else do you like to do beside work?","['lots of fun stuff. eating sleeping ð\x9f\x99\x82', 'these are important things to do in life ð\x9f\x98\x89', 'yeah. keep minimalist life style only do things you have to do ð\x9f\x99\x82']",3
what food do you like to eat?,['Asian food prefer spicy one'],1
yes yes yes! like that style. Do you like spicy food?,['I like noodle soup like Pho or Ramen. I also like Beijing duck a lot!'],1
what is your favorite place for ramen?,"['I love <REDACTED_TERM> in San Mateo', ""haven't tried that one! will give it a try next time!"", 'yes, you should!', 'Hi!', 'Hi!']",5
nice meeting you. what are you up to?,"['not much, thinking about lunch']",1
I love sushi do you know of any good sushi places?,"['arghhh hard question ... I only know Ramen places for Japanese food ð\x9f\x99\x82', 'ooh ramen is also good']",2
San Mateo to me has the best Ramen restaurants: Parlor and Dojo? oh no question mark ð,"[""I haven't been to those palces before. Going to have to check them out! thanks for teh recommendation""]",1
my pleasure ð do you live near San Mateo?,"[""no, but I'm willing to drive for good ramen"", 'excellent. let me know when you have tried those. I like Parlor better because it has soft-shell crabs', 'I""ve never had softshell crab before, but it sounds really good!', ""yup it's delicious!"", 'Hi!']",5
"Slowly, not much to do. Been twiddling my thumbs all day what have you been up to?","[""Oh, I would love to twiddle my thumbs. You're so lucky! Today, I've been mostly attending meetings, reading and writing docs, reading papers etc."", ""That's a lot! I've just been cloud gazing - I saw a giraffe and an ice cream cone"", 'wow! I sometimes drift off during work, and see similar things in my head.']",3
Mostly saving the world from mess on social media. How about you?,"[""I'm taking a break from work. Going to go travel the world""]",1
"Nice, what all places would you be going to?","['Australia and New Zealand to start then maybe Singapore', ""I just met someone who went diving in Australia. Apparently, you cannot fly 24 hrs after you dive, because your body accumulates too much <REDACTED_TERM> when breathing with a cylinder So, don't do that!"", ""Thank you for the tip! I don't plan on going diving, I plan to hike the mountains and go see kangaroos!"", ""That's equally amazing! I wish I can explore such places one day. It's just so expensive"", 'I won a lot of money through the lottery ð\x9f\x99\x82', 'woah!... You know sharing is caring. You should share that money with me :)', 'Haha, very true! Besides the trip, I donated the rest to charity so I will need to go back to work when I get back', 'you are a kind soul!', 'Hi!', 'Hi!']",10
How is your day going?,['It is pretty good. A little bit tired though.'],1
"My day is okay. At least, I'm not tired. What made you tired?",['I went to gym and worked on weight lifting.'],1
Oh. That's hardcore. Have you been lifting for a long time?,"['No, I am just a starter.']",1
Do you go to the gym often?,"[""I go everyday. In fact, I'm in a running challenge."", 'Wow', ""It's actually not that impressive. I can only run. I cannot lift weight."", 'You can get a coach to start it!', ""Oh that's a really interesting idea. I like to be coa"", 'Hi!']",6
It's a sci-fi book about aliens and a type of virtual reality. Pique your interest at all?,"['Slightly, I typically read fiction but I can curious what type of virtual reality is discussed in the book']",1
Cool. This virtual reality is a based on life on an alien planet. There is a twist though. Do you want me to spoil it for you?,"['Yes!', 'The virtual reality is actually based on a real alien civilization! And that civilization is coming to attack earth! dun dun dun dunnnnnnn', 'Woah! That is fascinating! I will have to pick up a copy of the book to read.', ""There are other twists as well, so I haven't spoiled the whole thing! To be honest I am not a fan of spoilers"", 'Thanks for not spoiling it completely but you gave a really intriguing description that makes me want to read it now. I will have to pick it up after work']",5
I only gave those a try when I had a concussion and could not read. I enjoy having a physical book in hand and reading at the pace I prefer. Do you listen to a lot of audi books?,['Hi!'],1
"Yes, the darkness can be a bit depressing. This weekend I went rock climbing! It was great! How about yourself?",['Rock climbing sounds fun! I had a pretty low-key weekend. Ended up going to watch a movie.'],1
Oh nice! What movie?,"['Knives Out. It had Daniel Craig and one of the famous Captain America ""Chris"" person (I can\'t keep track of all of the famous Chris names).', 'Hahah yes, they all look the same! I saw that very same movie over Thanksgiving break. Lots of twists and turns!']",2
"Cool. So if it weren't so dark and cold outside, what kind of activities would you do?","[""Hmm good question. Evening runs can be fun, but it can be a little scary when it's dark out!""]",1
"Yes! I've been to Australia. It was very nice; I regret not going to see the southern lights. Me personally, I like winter. But I'd prefer it to be more brief than it actually is here... Where are you from originally?","[""I've always wanted to go to Australia. I'm originally from the US."", 'Ahh me too! You should definitely try to visit Australia at least once!', 'Will do! Bye.', 'Hi!']",4
Iâm trying to organize my life and start the new year ready to go! What about you?,"[""Wow, that's impressive. Admit I'm just trying to take each day and week as they come.""]",1
What do you do to unwind?,"['Honestly, I like to catch Pokemons on my phone a lot. That must be upsetting since your name is pikachu though...sorry...', 'Oddly enough, I also catch PokÃ©mon on my phone. I used to do it more, but it just never ends. I used to do it everyday. Now I mostly catch them when I travel somewhere exotic.']",2
"In the game, i use vaporeon a lot. But I think pikachu is the cutest, thatâs why I changed my name to match. Lately, I think baby Yoda is the cutest though. Have you seen baby yoda?","[""I have heard of him and seen him here and there, but admit I don't have Disney+, so I only heard baby yoda is super cute and popular. Maybe I'll binge watch The Mandalorian in a couple of years like I did Game of Thrones...""]",1
Admit I really like watching Modern Family and Mix-ish. Reruns and new episodes. I find them cleverly written. What're you watching these days on TV?,"['I was watching cat rescue videos on YouTube a lot. There sure are a lot of stray cat babies that get stuck in pipes and gutters in South Korea.', ""Oh dear, I never imagined that happening. Poor things, but good to hear they're being rescued.""]",2
Do you like cats or dogs better? Do you have any pets?,"[""I used to have a cat, hamster and fighting fish, but they've all lived long lives and gone to pet heaven, but I sure miss them."", 'Hi!', ""hi there! it's a lovely day to chat with you""]",3
Isn't it just! What are you up to today?,"[""ah I'm waiting to finish work earlier to meet my son at home ð\x9f\x99\x82""]",1
ah he's like to ride his little bicycle around the house and asks me to follow ð what are you up to today?,"[""I'm taking a fake sick day from work so I can go to the movies.""]",1
haha that sounds like a good plan. who are you going with? ð,"[""Just by myself. I love seeing movies by myself, it's the best."", 'haha no one will interrupt you!']",2
Get out of town! It's Avatar too. What are the odds!?,"[""haha it's a great movie that I haven't found anything of the same quality"", ""Yes. Can't wait for the sequels."", 'Hi!', 'hello there, nice seeing you']",4
"oh wow, that sounds like so much fun! definitely count us in. what is your plan?",['Tentative plan is to drive to LA on 23rd and then stay at the Disney resort for 2 nights. I heard Christmas eve they have loads of fun events.'],1
"awesome, I think I won't tell my kids and surprise them last second. How bad do you think the traffic is going to be?",['Great idea! I will probably do the same. Surprise surprise.... Traffic might be a little harsh.'],1
"Good point. I am not sure about that. Let me inquire about that. If not, then we can look for an Airbnb closeby. Does that work?","['Yeah, I think so. It might be a tough decision though, if we want to have a nice dinner then we have to leave the parks early to start cooking. Another option is to have dinner at a restaurant.', 'but I would think everything is closed on christmas eve', ""Thats true. Hotels with restaurants sometimes offer dinners for christmas and new year's eve. We should call and ask about it.""]",3
I was thinking on getting a large set of standard legos. What will you get for yours?,"['Likewise. My son is crazy about legos.', ""hopefully they don't lose any in the trip. Its going to be hard to explain to them how santa managed to find us in the hotel!"", 'Hi!']",3
Hi! How's your day going?,"[""I'm doing well. having many meetings today ð\x9f\x99\x82"", 'Haha, nice']",2
Cool! Planning to spend a couple days at Tahoe What kind of board games do you like?,"[""we've been doing Games of Thrones lately. the game takes a very long time to finish though!""]",1
"haha, nope I don't watch it, but my roommate is super into it what other TV shows do you like?",['I love Survivor ð\x9f\x99\x82'],1
what about you?,"['nice! I mostly like comedy shows like The Good Place and Modern Family', ""cool, I'll check them out!"", 'Hi!', 'Hello']",4
Good so far. How's yours?,['Ehhh so-so. My moped broke down on the way to work this morning and I am in the shop getting it fixed...'],1
Oh! That's bad! How long will it take to get it fixed?,"[""The mechanic is trying to figure that out now. Apparently I wasn't supposed to be using diesel lol."", ""Haha! Hope it doesn't take too long. Let me know if you are able to make it for lunch.""]",2
"Okay sounds good. Would you be able to pick me up by the way, if they don't finish up here in time? Did you drive to work today?","['Oh, I have a packed schedule today at work. I will find time in about an hour. Let me know if that works.']",1
That should be fine I think. Did you catch the Warriors game last night btw?,"[""no, i was busy catching up with a friend. I heard they played really well. Rooting for them this season ð\x9f\x99\x82 Ahh, they lost again ð\x9f\x98\x9e Things aren't going to be too good until Steph gets better! Oh! I think they will find a way. The team still looks too strong to me."", 'Haha I appreciate your faith, but their record thus far is hard to refute!', 'hehe, i am true fan! Well anyways let me know how the repair work goes. I need to run now for a meeting. ttyl', 'Hi', 'Hello!']",5
any improvements in your marathon time?,"['No, only a few minutes. I still find it difficult to run long races']",1
I see. Are you planning to do any sporting events in the coming months?,"['I think a triathalon would be cool', ""I like doing Spartan race. It's an obstacle race which is challenging but not overtly so like marathons and triathlons""]",2
"I haven't heard of a Spartan race before, what does it involve?","['It has abt 20 obstacles like crossing high walls, monkey bars, etc. Its fun', 'oh wow a full obstable course. that does sound fun! I like the variety']",2
hmm that sounds very soon. would there be enough time to train? I think I would like to try one later in the year,"[""1-2 months is a good amount of time, if you workout regularly. It's a lot about the technique, which we can practice in training sessions."", ""ok, sign me up. it's more fun to do it with friends"", 'Awesome! There is a training ground in San Jose. Will coordinate with you next time we go for practice.', 'Sounds good!', 'Hi!']",5
"Hey, how are you doing?","[""I'm great, thanks. I'm getting ready for a skydiving lesson.""]",1
"ooh, nice. That sounds adventurous. Where is it?","['Right near my home town: Seville, Spain.']",1
Yes. I'm feeling a little trepidatious. Have you done it before?,"['Nope, never! I know a couple of friends who have. They mentioned its absolutely terrifying. Good luck!']",1
"White water rafting, definitely! As for skiing, that depends on how fast you go. Do you ski a lot?","['nope, whenever I went fast I fell badly', 'I tried skiing once, and by the end of the beginner class I was able to make it down a baby-sized slope. I was very proud of myself.', ""Yeah, they make you do that. I also tried going down the baby slope, but my stopping wasn't perfect, and I mostly fell at the end"", ""Hey, so long as you get to the bottom, it's all good!"", 'Hi!']",5
I was not able to attend the lectures last week. Can you help me understand some concepts?,"[""well, I'm not sure I'm the best for the job, but I can try!""]",1
"No problem! Sure. We still have plenty of time for the test. Anyways, how's your preparation going?","[""not feeling too sure about it tbh. I've been super busy so I haven't study much ð\x9f\x98\x9e. I might join some of the study sessions later"", 'Same feeling here! But i think the syllabus may not that tough. You may be able to cover it up over the weekend.', ""not my ideal idea of a weekend, but I guess it'll have to be like that."", 'True! This will be a very hectic November! I do like the course content though. Its very much up to date with latest research findings.', 'yeah, our professor really goes out of their way to make the class interesting, glad I managed to get in it.', 'Thats pretty cool! I hope you do well next week.', 'thank you, bye!', 'Hi!', 'Hello!']",9
How was your party last week?,['It was really fun! We are a bunch of turkey'],1
haha... you ate Turkeys' or you like calling your bunch Turkey?,"['*ate ð\x9f\x98\x82', 'Haha... thought so! But it was funny eitherways', 'So much turkey leftovers']",3
"did you cook it at home, or got it from outside?","['We cooked it at a friends house. I brought the mashed potatos haha', 'Nice... I always find it hard to fit the turkey in my small oven. Also, we are not big turkey fans... so we roll with Thanksgiving with chicken ð\x9f\x98\x89', 'chicken also sounds good']",3
We played pictionary. I never played before but it was a bunch of fun. what did you play?,"['Pictionary is fun! We played office tennis. In that we take paper balls and using writing pads as rackets, two players have to work together to put the ball in a bucket kept at a distance. It was a lot of fun.', 'that sounds very challenging', 'Hi!', 'hello']",4
how is the youtube video creation going?,"['going pretty good, I was about to finish composing my second song and post it on youtube/soundcloud etc']",1
Whoa! Looking forward to listening to it. What softewares you use for it?,"['I used logic pro x, pretty handy stuff as you can write code to generate guitar strumming pattern']",1
oh cool! What sort of music do you compose?,"['I got most inspired by Jazz and electro swings, but am trying to get more into jpop recently as one of my band member likes anime', 'Nice.... you are a rockstar! ð\x9f\x98\x89']",2
"haha thanks, do you plan any instruments?","['Yeah.... I play bit of guitar. Just got my first monitor this week', ""nice I'm tyring to learn guitar recently also, it's so hard to play f chord"", ""yes, the bar chords are the worst. It took me several months to play them well. I still can't play them for a long time though"", 'right, but bar chords are so versatile, almost like cheating as in you can play anything with the same gesture', ""That's true. It's like the alphabets in a language. Once you know them, you can pretty much write word"", 'will spend more time work on my bar chord!', 'Hi!']",7
Hey! Howâs your day going?,['Bruhhhhhh!!!!!'],1
What??,['I was screaming in agony upon recounting my day.'],1
Oh no! Whatâs happened?,"[""A project I've been working on for some months got shelved. So I'm a mix of helpless, sad, and angry."", 'Ah that sucks. At least itâ\x80\x99s not personal. Not that it helps right now, but that does happen all the time']",2
Lol. Would you say that to someone who lost a loved one - or some similar circumstance?,"['Well, no, of course not! Let me stick with â\x80\x9cAh that sucksâ\x80\x9d by itself, then.']",1
No worries. Was pulling your leg. I forgot to ask how your day was going?,"['Haha, apart from having my leg pulled mercilessly, itâ\x80\x99s going great ;). My main problem today is deciding what to have for lunch.']",1
"Oh I hear a lot about keto. Iâm trying to watch my weight, would you recommend it?",['Hi!'],1
"I normally don't reflect back too much on things, but i guess 2019 have been very favorable for me in terms of time spent with family and friends and work life balance. Why do you ask?",['I just released a book on <REDACTED_TERM> to help people process the past 12 months and start the new year with a fresh outlook ð\x9f\x99\x82'],1
Great! Good idea to help people figuring out their new year resolutions ð So how do i get a fresher outlook? ð,"['Well, in my book, I took inspiration for the 24 days of Advent, and put together a workbook that you fill out each day for 24 days. It goes through accomplishments, passions, understanding, forgiveness, with each day a different theme.']",1
Wow! Sounds amazing if we practice that! I think the idea does have some potential. How did you come up with this idea?,"[""We created a scholarship for leaders from <REDACTED_TERM> to visit an international institute at <REDACTED_TERM> for which there was no African representation. During the program, we also did a lot of coaching with the young leaders. This book captures a bit of that journey that we are all on, and also all the proceeds are going to fund next year's cohort."", 'Thats great! This is valuable help for the community. I think mental health is one of the bigger challenges facing humanity.']",2
"I think if we were all able to bring out our best selves, the world would be much better. When did you first realize mental health was important?","['That is actually a quote stolen from my TL when i joined my first company after graduation. I guess now after 5 yrs of work experience, I fully agree with it ð\x9f\x99\x82']",1
1. stay happy; I think family and friends play a big role here. 2. Meaningful work life; this may mean exploring around with new stuff 3. multiple hobbies that keep you busy ... so on ð What about you? is there a right answer to this? :),"['1) The idea of what it must be like to be ""on Earth as it is in Heaven"" from the Lord\'s prayer. I feel like we were designed for a purpose, rather than random chance. A more concrete way to put it is simply show love to the greatest capacity we can. 2) Taking care of myself physically, mentally, spiritually. 3) Family 4) Work 5) Music', ""Nice! That's very thoughtful and spiritual ð\x9f\x99\x82 Also music earned a spot ð\x9f\x99\x82 yay!""]",2
"Yea, I've always said that if I wrote a memoire, I would title it: ""Jazz, Jesus, and Video Games."" Do you have a title of a book that you've thought of writing before?","['I am actually not much of a reader. I usually hide it by quoting john nash ~ reading books corrupts original thoughts ð\x9f\x99\x82', 'Thatâ\x80\x99s why you write your own books! Then itâ\x80\x99s all your thoughts on your terms :)', 'Hehe! True! It may turn out to be a best seller :)', 'Hi!', 'Hey!']",5
"Having fun, but have a bit of a headache How about you?","[""I'm good! Just getting ready to watch a basketball game. Hope your headache goes away!""]",1
"Hmm, try taking some <REDACTED_TERM>! I'm going to see the Warriors vs. the Grizzlies. Ever see them play?","[""I haven't Honestly I probably wouldn't be able to identify which sport they played""]",1
"Haha, all the animal names confuse me as well! Who came up with these naming conventions? I'd name my team something more original: The New York Chairs!","[""lol, sounds better to me :) I'm actually at the <REDACTED_TERM> opening remarks""]",1
"Oh cool! What is ""NeurIPS""?",['Neural Information Processing Systems'],1
Oh wow! Sounds fancy! What is that about?,"[""It's the biggest ML conference in the world""]",1
"Oh, ML?","['Yes, machine learning']",1
"Ahh! I saw a scary movie about that once. It was about this sentient AI in a dystopian future - very very creepy. It was called Wall-e, ever heard of it?","[""I've definitely heard of it, but somehow never saw it!"", 'Hi!', 'Hello']",3
how's it going?!?,['Good so far. Very excited about the game later today.'],1
what game?,['Giants game. I got tickets for the game.'],1
nice. that's football right?,"['Yes, I think the traffic will be bad. I need to leave by 4.']",1
Its the one close to mathilda. 15 mins driver from here. You have any plans for the weekend?,"[""yeah I'm gonna go kayaking"", 'Kayaking sounds fun! I tried it in our last team offsite.']",2
is it easy to flip over accidentally? it's gonna be my first time actually,"['I found it very tough to learn, but my friends picked it up very quickly. I am sure you will do good.', 'thanks!', 'Cool! I need to run for a meeting. Talk to you later.', 'Hi!']",4
Did we dance together perchance?,"[""We might have, I don't remember that much of that night.""]",1
I'm a cardiologist in Palo Alto. I have a private practice. You?,"[""Thats pretty cool! I'm a sofa tester in cupertino."", ""I'm not sure I know what that is."", 'well its very simple, I test how comfortable sofas are.']",3
Lol. Not to be elitist but...that's a real job?,"['Yeah! It is a very demanding job, requires a carefully crafted set of skills. They pay is really good too.', 'Hi!', 'Hello. Deja Vu.']",3
what does that mean?,"['It\'s French for ""already seen."" I know it\'s used when you see something for the second time or you have the feeling that something has happened before and you\'re re-experiencing it.']",1
Interesting. I get that feeling sometimes. It just feels that the event is replaying. Wonder why it happens?,"[""I think it's your mind lapsing somehow.""]",1
How do you know so much about this French phrase?,"['I thought it was common. I hear it a lot in popular culture - movies music etc. Jay Z has a song called Deja Vu, so does Beyonce. So I looked it up one time. It\'s one of those phrases that was carried over exactly to english like ""etcetera"" ""vice versa"" ""savior faire"" and so on. I like cool word origin facts.', ""yeah... that's pretty insightful. Never thought of etcetera that way before."", 'My favourite word origins are gymnasium and jazz.']",3
wdym by word origins here?,"[""First usage and original meaning. Gymnasium meant place of nakedness and had very little to do with working out. Jazz comes from jism which means semen and was originally sporadic sex music now it's elitist, high art."", 'Very interesting. I learned a lot in this conversation today ð\x9f\x99\x82']",2
You got any cool facts?,"['My friend used to tell me this and found it funny - Mosquitos have 47 teeths', 'That was quite a laughter!!!', 'Tell me a joke!', 'Google for that:)', 'Hi!']",5
"Hey, how are you?",['Pretty good. I just drank this new hint water. so good'],1
"ohh, what kind of ""hint"" did it have?","['watermelon', 'nice, I love watermelon. But, I prefer normal water over flavored one. Flavored water has too synthetic flavor', 'I see. Yeah some are pretty strange']",3
"Talking about strange flavors, what is the weirdest tasting thing you have tried?","['lol I tried this tangerine walnut icecream that was super weird', 'haha, I work close to a cafe which once prepared a paprika icecream', 'that sounds pretty tasty actually', 'It depends on who makes it. The cafe close to me messed it up really bad', 'do you want to get some of that icecream together some time. show me a good place', 'As far as my experience with that ice-cream type goes, all I know are bad places', 'lol', 'But I do know some gelato places which are amazing! You should try out those', 'Hi!']",9
"I'm actually a cake chef, so not far off! Creepy how good that guess was.... Are you psychic?","['I had a strong intuitive feeling connected to pastries when we started chatting, but that might have been because Iâ\x80\x99m hungry.', ""haha you're too funny! Perhaps instead of mind-reading powers, you have the ability to feel the auras of foods that have come and gone...""]",2
Chocolate cake + vanilla icing is the all time best! And I have the authority to say that! How about you? Have a favorite?,"['Ok this is a bit shameful to admit, but I love a classic carrot cake.']",1
