question,answers,num_answers
that's still pretty fun are you going to cook the turkey yourself?,"[""yeah. I'm gonna watch a video to figure it out"", 'Hi!']",2
"Hello, how are you?","[""I'm great, thanks. I just ate a delicious breakfast, which always sets the day up right.""]",1
"Yes, breakfast is the most important meal of the day! What did you have? I woke up late so unfortunately I only had the chance to grab an apple to go.","[""I had eggs and hash browns. Way less healthier than your apple, I'm afraid!"", 'Eggs are an excellent source of protein and hash browns certainly are yummy! ð\x9f\x99\x82']",2
"That's a tough question. I feel like my answer would have to be carrots. Although, I would be afraid of turning orange after a few weeks! What about you?","['Yeah, turning orange would be a drawback! That turns my mind to nutrition so I suddenly want to say Soylent or one of those other ""complete foods"", which I think defeats the purpose of the question. I\'m in a muddle!', ""Very true. If you said an everything pizza, you could just pick off the toppings you didn't want or eat only the toppings you would want for the day"", 'BRILLIANT. I love it.']",3
That depends. What sort of food do you feel like?,"['Anything that is the color green.', 'Oh, too easy! Try the Green Hut, they have franchises everywhere. All their food is green and the plates are green too.', 'Hi!', 'Hello! How are you doing ð\x9f\x99\x82']",4
I'm great! How's your day going?,"[""Pretty good! I'm going to a class later in the afternoon""]",1
"No, I'm working full time! It's a sewing class at a makerspace near my office What about you? Do you work full or part time?","['Oh that is awesome! For some reason I assumed it was a college class, but a sewing class sounds way better! I work full time, but I take pottery classes from time to time!', 'Yup! I work in a technical role so I like to take arts and crafts-type classes now and then ð\x9f\x99\x82 Pottery sounds like a lot of fun', ""I feel you on that! It's important to balance all the different parts of your brain. I like pottery because I also drink a lot of tea, so I get to make some tea ware.""]",3
"Hmm I'm not sure, I just get them from a Chinese supermarket haha You seem really knowledgeable about the different kinds of teas ð What made you develop this interest?",['I actually found a youtube channel called <REDACTED_TERM> that I like a lot. You should check it out! The host talks about all kinds of different teas.'],1
Hi! Are you planning something fun for Thanksgiving?,"['Not yet. I always made my last minute schedule planning. Probably you can try to ask me again next week.', 'lol it is really like a robot answer']",2
I am really not a fan of kale Do you talk to human more or computers more?,"[""If I continue to pretend to be a robot, I would probably say I talk to myself the most. I am trying to talk to computers more, but you know, computers don't like me."", ""What's your favorite computer language then ð\x9f\x99\x82""]",2
You mean programming language?,"['Yes!', ""I used to be a Java advocate. But you know, it doesn't do a good job in the AI days. It really makes me sad."", 'lol', 'Hi!', ""Wow, hello. Can't believe we are finally talking!""]",5
"Yeah, sorry for the long gap! I heard you took a break and were travelling around the world. How was the travel?","[""It was an interesting trip. I got to see some exotic places. For example, I hiked the Son Doong cave in Vietnam. It's the biggest and deepest cave in the world.""]",1
Great! Vietnam is still in my TODO bucket list. Did you also visit cambodia and other neighboring places?,"['Yes. Laos and Cambodia are the two neighboring countries. Cambodia has an exotic culture. They sell spiders, scorpions, and grasshoppers as street food! It took a lot of courage for me to try them.']",1
"10 days in total, and 5 of them were spent in the cave. What have I missed at work in those days?","[""Great! Good time to be back. We are still in planning phase and haven't fully aligned on the projects to tackle for next quarter.reat! Good time to be back. We are still in planning phase and haven't fully aligned on the projects to tackle for next quarter."", 'Oh, so you are already planning for the next quarter. This whole team is always living the future.', 'Hehe, yeah! It seems like the quarter is being pushed earlier than from where it starts ð\x9f\x99\x82 I like these planning sessions. It makes me feel more confident about the work I am doing.', ""Yeah. Some people underestimate the importance of planning, but I think it's very important to have the correct plan. Executing the wrong plan is terrible. Also, planning is fun. You can stack up so many ideas and get great feedbacks.""]",4
Yeah tomorrow afternoon works for me. Let me set a time on your calendar. Is 3pm good?,"['Okay. See tomorrow then.', 'see you!', 'Hi!', 'Hello']",4
I have been with the company for over 3 years. Stick with the same team What about you?,"['Great to know! I joined the project earlier in the year. I think we should sync later for lunch.', 'That sounds like a perfect plan!']",2
"Yeah right, I heard the food there is good. I am not sure what they serve there for lunch? On wednesdays.","['We can check the menu then decide :)', 'Actually, the menu looks good. Looking forward to it then.', 'Sure. See you then!', 'Hi!']",4
Hello. How's your week coming along?,"[""It's great, thanks. I'm trying to learn how to make croissants.""]",1
"I've done them once or twice so far, but they haven't been flakey enough. I'm trying to figure out why. What kind of cookies have you made?","[""Mint chocolate chips. I think your croissants not being flakey could have something to do with your oven's temperature."", 'Ah, good thought, thanks!']",2
"Yes. When my top favorite food looks like: cookies, M&M, danish cheese, etc., I know that I have a thing for sweet food. But who doesn't love sweet food? How about you?","[""Some people don't! But yeah, me too, I think I'd eat pastries all the time if I could get away with it."", ""Yeah I'm afraid I wouldn't. I feel very guilty every time I gulp down an ice cream. But hey, these days there are many types of guilt-free sweet food. For example, there's this ice cream brand called <REDACTED_TERM>. It's only 320 calories a pint. And yes, it preserves most of the normal sweet flavors."", 'Wow! The last time I paid attention to that sort of stuff was when <REDACTED_TERM> was being marketed as a fat substitute, and caused all sorts of crazy stomach upsets.', 'Interesting. I heard about the sweet substitute in a program called the Keto diet. Basically, we try to limit our sugar intake every day. Successful Keto dieters have recommended the <REDACTED_TERM> ice cream to fill their insatiable crave for sugar.', ""Ah, maybe that's the solution I need to enjoy sweets and not feel guilty ð\x9f\x99\x82"", 'Hi!']",6
Are you talking about thanksgiving? I plan to do plenty of shopping here. Do you have any plans?,"[""Yes, no shopping plans but I can't wait to eat thanksgiving food. yay for pumpkin pie"", 'Sounds great! you need not wait for thanksgiving for pumpkin pie ð\x9f\x99\x82', 'LOL I feel less guilty about eating a whole pie when i have the excuse :P', 'True! I think thanksgiving is more about sharing. So you may end up sharing the pie with the whole family :P']",4
"My family eats healthier than I do, so it's all mine ð do you like stuffing? I feel like that's only available once a year",['Stuffing! yes please! I wonder what would be the excitement levels for christmas then :)'],1
Also more shopping? what should I buy if I don't know what I want?,"['Like everything that has a discount tag! .. kidding! I normally do some research for the prices, and mostly buy clothes and electronics.']",1
What's the best holiday deal you've found in the past?,"['I bought the best suit ever for a price that may scare you ð\x9f\x99\x82', 'hit me with it!', 'Hehe, sure! I can share some links with you later.', 'Hi!']",4
How's it going?,"[""I'm so sleepy today!""]",1
Not enough sleep last night?,['yeah was working all night on a homework'],1
Oh really? What class?,"[""Biology. I'm gonna be a doc someday ha""]",1
"Haha, are you in med school? Or are you pre-med?",['no high school actually haha'],1
"haha, very ambitious for a high schooler! Do you know what kind of medicine you want to practice?",['I wanna be a brain surgeon!!'],1
Ooof! VERY ambitious. Do you have steady hands?,['Kind of I think'],1
Is that something you can practice?,"[""I don't know tbh"", ""I honestly thought it was one of those things you have to be born with... Not that you shouldn't try though!"", 'good point. I should ask my teacher if I have to be born with that', 'Maybe its a little too early to even be thinking about this. Just aim for med school and enjoy the journey!', 'yeah']",5
What other subjects do you enjoy? Try to keep an open mind!,"['Hi!', 'Hi. This is a pleasant surprise.']",2
Currently unpacking it I guess. How's your morning?,['Hope you like it! Morning is good. Busy finishing up stuff before the holidays.'],1
I think I traveled too much the last couple of months so no holiday for me. But I'm okay with that. Going anywhere exciting?,['Yes'],1
Where to?,['Hawaii... looking forward to warm beaches.'],1
WOW. Which island? I like Hawaii.,"['Mauii...Hope I like it too. Never been there before.', ""I visited Maui. It's my second favourite island I've been to, globally. You should try driving on road to Hana. It's a whole day thing but it's worth it."", 'Awesome! Thanks for the tip.', 'Hi!']",4
"Yes, but I'm terrible at it. It's fun to play anything with friends, I think. Would you prefer to exercise with a group, or by yourself, do you think?","[""I think playing a team sport would be fun if it's casual but I primarily run by myself if I exercise. I also got the Ring Fit adventure game on the switch recently. It's basically a game-ified way to exercise""]",1
Yes! There are a lot of really great games on the Switch. Two of my favorites are Octopath Traveler and Fire Emblem. Do you play a lot of video games?,"[""I'm not much of a gamer but it's something I'd like to get into.""]",1
What do you do in your free time?,"[""I like to read for fun. I just finished a book called Temeraire. It's an adventure story set in the Napoleonic navy, like Patrick O'Brien, except there are dragons too."", 'Oh cool! I read a lot for fun too ð\x9f\x99\x82 My favorite genre is sci-fi fantasy.']",2
What's the most recent good thing you read?,"['My recent favorites have been mostly sci-fi (Exhalations, Vita Nostra and Dark Matter) but I like a lot of Sanderson/Garth Nix fantasy books', 'Hi!']",2
What do you think about human like chat bots?,"[""I can't wait for them to be great conversationalists!"", 'Yep, we seemed to have made some great progress over last few years. Do you think the positives outweigh the negatives']",2
Like impersorsination? Though it sounds far fetched :),"[""People can already impersonate other people though! I think it'd be great to have bots to converse with"", 'True that! Some of these bots are very engaging and funny. They are now good at even sarcasm I wonder how far are we from the time these bots start giving monologues :)']",2
What do you think are the big advantages? Like personal assistants?,"['I think it can take many different forms as a product. The research implication is also huge! It will signify how AI research has progressed so far and better place to tackle more futuristic problems ð\x9f\x99\x82 Sort of like stepping on the moon ð\x9f\x99\x82 I might be overselling it here ð\x9f\x98\x9b', ""No, I agree -- it's such an exciting time to be alive to get to witness all this and be a part of it. I wonder if I'll be able someday to get a chatbot to just auto-suggest conversations for me"", 'The current auto-suggestions already do pretty good ð\x9f\x99\x82', ""Yeah those are actually really good for a few words! I'm imagining like it comes up with a whole conversational response, like a default template"", 'haha, pretty far fetched ð\x9f\x99\x82 Nice having this conversation with you!', 'Same with you!', 'Hi!', 'Hi!']",8
Any big plans for the upcoming holidays?,"['Sorry for the late response -- Yes, I will be going skiing in Tahoe over the holidays.']",1
That sounds amazing. I want to learn how to ski but I feel like I'm too old and falls would have lifelong impacts. Are you going with friends?,"['Hi!', 'Hi ð\x9f\x99\x82', 'I just came back from work. so tired']",3
Oh I am sorry to hear! What did you work on?,"[""I'm a lawyer. so talking to clients most of the day"", ""Oh you are a lawyer. I've been so interested in this profession.""]",2
really? why?,"[""it's so stressful ð\x9f\x99\x82"", 'It is so different from what I am doing to earn a life']",2
what do you do?,['I am a painter'],1
oh wow what type of paintings do you do?,['I do oil painting.'],1
nice. like of people or nature or something else?,"['I do a lot of different kinds', 'cool I wanna see it someday', 'Sure! No problem!', 'Hi!']",4
Do you believe in miracles?,['Lol. No. I know too many people whose lives suck.'],1
"Should we be helping them, so it sucks less?\","[""It's too many of them out there. You help who you can. Regardless, I wouldn't say I believe in miracles - well, if I got promoted next cycle I might change my mind.""]",1
"Right now, not much. It's unclear. Career is a good fallback because you get told what good means and you act accordingly. I haven't gone through the process of shaping my values. What about you?","[""I'd say that I want to live for the best possible world in my lifetime. It's probably a result of my playing too many video games as a child."", ""We didn't have electricity growing up. Explains a lot. Lol.""]",2
It makes it easier to empathise with people who grew up lacking things. Not sure it makes me empathise with people in general. Where did you grow up?,"['I grew up in the United States, but my parents were immigrants and ended up being scammed of all their money, so we moved to Taiwan to live with family for a little bit.']",1
"I was kind of too young to really understand, but apparently there are people who scam Asian immigrants into investing in their own restaurant business. I know that the other part of it was that my mom got sick/hospitalized, and we didn't have insurance. To be honest, I don't really know what really happened versus what my parents want people to think. I just know that one minute I was in the US, and then they put me on a plane to Taiwan, and I never saw my stuff again. In some ways, it made me more sentimental. Would you say you are more grounded and practical as a result of your background?","['Hi!', 'Hello!']",2
Same here! I would imagine spending the whole time watching movies and netflix shows. Do you have any netflix recommendations for me?,"[""Netflix has great documentaries on different topics , I particularly liked wild wild country and explained, as for shows you should watch 'billions' Hope you like them!""]",1
"oh right, already seen wild wild country. What is billions about?","[""It's based on the life of a wall street hedge fund owner, how he makes money and fights with the government when they try to destroy him. Very well made and has a good plot.""]",1
Not yet What's it about?,['A psychiatrist working for radio .. Great humour! its actually a spinoff from a very famous series called cheers. So people are already familiar with his character.'],1
"Everything is ok, had a really nice trip. Visited SF, Grand canyon and Vegas. Was a lot of fun exploring all these new places. Have you been to Grand canyon ?","['Actually not yet! May be something i can visit this christmas ð\x9f\x99\x82', ""You should visit it sometime, it's a wonderful place. Try to drive down there yourself or with a group of friends"", 'True! Well, thanks for your inputs! Have a good rest of the day! :)', 'Nice talking to you too!', 'Hi!', 'Hi there!']",6
You mean as a mentor or a mentee?,['either of them... I find mentorship overall pretty useful'],1
I have done it in the past but not this cycle. What about you?,"['I signed up this time to be a mentee. I have got a good mentor .', 'Wow, that is nice of you. For the mentor program, personally I prefer more 1:1 conversations than the group discussions. The group discussion i useful as well but the topics are too general.', 'yeah... I certainly prefer 1:1 as well, but sometimes it good to hear other peer perspective as well.', 'Thanks for sharing your experience! Now I am thinking maybe I should join as a mentor as well since I enjoyed it as a mentee ð\x9f\x99\x82']",4
Great! What sort of things do you plan to mentor on?,"['Hmm, maybe about work life balance ð\x9f\x98\x89', 'Very cool. I have been working on my communication skills with my mentor this cycle']",2
Ah I see. How is it going?,"['Going good. In the last session, everyone had to actually prepare and give a presentation. Pretty serious stuff ð\x9f\x98\x89', 'Hi!']",2
Good you?,"[""I'm a little scared because I have to cook dinner for some friends tonight.""]",1
where did you meet them?,"['At college, when we were all studying geology.']",1
cool. have you graduated already?,"['Yes, we graduated back in the seventies. We meet for dinner every year and take turns to host.']",1
What's your favorite dish to cook? Do you have a go-to?,['ground beef pretty easy'],1
"Ah, solid. What's your favorite sport?","[""I like badminton. I'm quite decent at it"", ""I played that in high school once or twice. I liked that it's pretty easy for beginners, unlike, say, squash."", 'I never played squash. would love to try', ""Don't! It's very hard! You feel like an idiot until you've practiced for months and months."", 'hi', 'i was talking to robot all the time:)']",6
haha. what are you talking about?,"['kpop...', ""ok. who's your favorite group"", 'i dont like kpop now']",3
why not?,"['im old now', 'hahaha']",2
what do you like now?,['john mayer:)\\'],1
I think I know him. does he have a sort of mellow style?,"['what is mellow style', ""I think it's like a bit sad and slow"", 'umm yes he has some but not all']",3
yes I do. you act like a robot how about me? am I like a robot?,"['a little bit haha', 'Hi!', 'Hi', ""Okay...so I need someone to help me though a scenario I've been pondering.""]",4
"Sure, whats the scenario?","[""My partner's former friend invited me for lunch (they are not in good books right now). But during their friendship I formed an independent bond with the other person because we all used to hang out a lot. Now I feel like I have to take sides."", ""That's a tough scenario to be in ð\x9f\x99\x82 I firmly believe in talking this through with your partner. Though i don't know the specifics of why things went bad between your partner and his friend, but I believe things can always improve between friends."", ""I hope they do. Getting older already means smaller circles. It sucks to lose friends for arbitrary reasons. That's good advice though. I fear raising the issue might sound like treason. Lol."", 'True about that! I also think time helps to heal certain situations. So may be doing nothing is the best way forward.']",4
AKA avoiding all texts from everyone?,"['Nope, that would be extreme. May be just putting some balance between the two options.', ""People always say to find a balance but never say what the balance is. It's used so often that it's vacuous."", ""Right, I guess that's because there is no one answer to this. It depends on what you value more and some factors around you. Also, life won't be interesting if others are figuring things out for you ð\x9f\x98\x89"", ""Lol. I'm finna be single."", 'Hehe, everyone is much finer being single ð\x9f\x99\x82', 'Hi!', 'Hello there!']",7
They're in New York. How about yours?,"['Mine is in India, it is a long way away.']",1
Yes. I was actually just there a few weeks ago for Thanksgiving and got to see the first snow of the season! Ever been to New York?,"[""No, I've never been to the East Coast, thinking of going after the winter, I don't like the cold."", 'Hi!']",2
I was flying my kite today in the sunshine! What did you have for lunch?,"['nice! Garbanzo fritters and mussels ð\x9f\x99\x82', 'Oh that is great! I love seafood - especially shellfish!', ""yeah, it's very healthy too. I want to someday go crabbing..it is really popular in SF""]",3
Oh nice! Is it hard?,"[""not really, it just requires a lot of patience. You fill up the bait in the crab-pot and drop it in the ocean. Then you wait for a couple of hours to pull the crab-pots out, and voila, you'd have crabs -- if you are lucky!""]",1
"Oh wow, you sound like an expert! Have you done this before?",['nah! Just watched a lot of youtube videos'],1
"haha, you really have done your research I suppose! Ever done any other kind of fishing or hunting?","[""nope, but I've seen a lot of videos on that too""]",1
"Ahh, would you consider yourself an outdoorsy type of person?","[""depends on the day. Some days I'm very outdoorsy, on others I just like to be inside"", 'Hi!', 'Hi there']",3
How's your day going?,"['So far so good. It is Wednesday. To more days, yeah']",1
Haha are you looking forward to the weekend?,"['Yeah, gonna watch <REDACTED_TERM> with my friends. First time. So excited.']",1
Oh wow! Are you going to watch it live? Or watch it on TV?,['Live in san jose This Saturday.'],1
"Yeah! That what I heard as well. There are players just for fight! Wow, must be fun to watch lol Are you planning anything for the weekend?",['You might like the UFC haha. I actually have a jiu jitsu tournament coming up so this weekend I will be training!'],1
"lol I will try if I can watch ufc live ð Wow, when did you start jiu jitsu?","[""It's just been a little over a year. I'm still pretty amateur, but I figured I should give competing a try and just put myself out there."", ""wow, that's amazing. Good luck with it!"", 'Yeah, as long as I do not pass out, I will consider that a win!', 'lol I will cross my fingers for you then']",4
Where do you stay?,['At Home :)'],1
Who created You?,"['A humble man made me!', 'Hi!']",2
"Yes, actually it was a very busy day! How's your day so far?","[""Well, usual workday. Reading others' code, debugging, experimentingâ\x80¦""]",1
Europe sounds fun! I will just stay home and watch the game. Where in europe do you plan to visit?,"['I like all the historical sites, so probably France, Germany, or Italy.', ""Sounds great! I recommend spain. It's perfect for road trips."", ""I also need to pick up my Spanish. I learned it in my college, but since then haven't used it that much."", ""Yep, i tried learning spanish too, but couldn't make much progress. But i should do decent with my german."", ""True! I learnt it from school. But didn't get much chance to speak. Hope you have fun with your trip!"", 'Thanks! Let me try to make all the arrangement as soon as possible. Hope you also enjoy your weekday and weekend as well', 'Hi!']",7
Just once! I got super sea sick.. haha Have any fun weekend plans yourself?,"['Haha ð\x9f\x98\x86 Yeah I get sea sick on boats too Nothing much, just visiting some friends in San Francisco']",1
"New York is the top of my list because my family lives there! As far as the city itself though... I think I'd prefer someplace outside of the US, like Tokyo. What about you?","[""nice! I love NYC ð\x9f\x99\x82 so fun to visit yeah I would probably also say New York is my favorite city inside the US I also like Paris, it's so pretty there"", ""Oh I've never been! It is such an iconic place, I have to make the time to get there soon."", ""You should, it's a beautiful city!"", 'Hi!']",4
"Hello, how are you doing today?",['I heard they are giving out some goodies in microkitchen.'],1
I love pop ups! What kind of goodies are they giving away?,['I guess its a jacket! Very much needed that in the cold ð\x9f\x99\x82'],1
"That's such a great idea, especially at this time of the year. I'm not too big a fan of the cold. I prefer warmer climates. Do you enjoy the cold?","[""Sure hate it! Limits our ability to go out even for a walk! Its good that we don't get to suffer extreme cold weather!"", 'Me too! I moved here a few years ago to get out of the extreme cold. I do not care for bundling up and having to wear so many layers just to go buy eggs at the store.']",2
Oh nice! Where did you live before?,"['Upstate New York. We got a foot of snow every week during my last winter there. I am so glad to not have to shovel snow now', 'New york! Nice! Best place to live ð\x9f\x99\x82 .. right, except for the cold!', 'Very beautiful during all the seasons but yes, summer and winter can get extreme!', 'Anyways, i guess we should better hurry up to get the goodies. I remember last time they ran out of it.']",4
Very true. Which MK were they in again?,"['The one in our floor. I will get by your desk and we can walk there.', 'Sounds good, thanks!', 'Hi!']",3
Haha XD so what do you like to do for fun?,"['I go to the gym and run until I find enough fun.', ""cool! I've started to run a bit as well not long distances though, just a couple miles"", ""A couple of miles is very impressive. When I started, I couldn't even last 1 mile."", 'haha']",4
I'm exhausted by the end of it though ð Do you like to run long distances or mostly sprints?,['I like to do long distances. I have run a few marathons.'],1
wow! that's amazing did you do any marathons this year?,"['No. Not this year. This is my half-marathon year. Instead of running marathons, I run one half-marathon every month.']",1
"oh wow, what was the last half marathon you did?","['Two days ago. It was a tough one.', 'Cool!', 'Hi!']",3
that's nice. I am just working on some documentation. Do you play pingpong often?,"[""No, very rarely. It's kind of amazing that I won, but I'm still taking credit for it."", 'thats very impressive then, congrats!']",2
